,name,position,company,description,linkedin_url
386,b'Jill Schwieters',b'Executive Vice President/President Cielo Healthcare',b'Cielo (formerly Pinstripe)',b'Healthcare & Business Executive | Authority on Transformational Strategies for Healthcare Organizations | Speaker',b'https://www.linkedin.com/in/jillschwieters/'
387,"b'David Galbis-Reig, MD'","b'Vice President, MD'",b'Wisconsin Medical Society Foundation',b'Medical Director of Addiction Services at Ascension Wisconsin (Formerly Wheaton Franciscan Healthcare) All Saints',b'https://www.linkedin.com/in/david-galbis-reig-md-8403a310a/'
388,b'David Wolff',b'Vice President of Finance',b'MHS Health Wisconsin (Centene)',"b'VP, Finance - MHS Health Wisconsin (Centene)'",b'https://www.linkedin.com/in/davidmwolff/'
389,"b'Rapp, Cathy'",b'Vice President Board Of Directors',b'Hope Center',"b'Clinical Services Officer at Community Care, Inc.'",b'https://www.linkedin.com/in/rapp-cathy-772a5b30/'
390,"b'Alan Mendeloff, FHFMA, CHFP'",b'Regional Vice President for Sales',b'Executive Health Resources',"b'Regional VP, EHR'",b'https://www.linkedin.com/in/alan-mendeloff-fhfma-chfp-613a745/'
391,b'Angie Broich',b'Manager of Administrative Services/Executive Assistant to Vice President of Sales & Marketing',b'WEA Trust',b'Manager of Administrative Services/Executive Assistant at WEA Trust',b'https://www.linkedin.com/in/angie-broich-a82b4ab9/'
392,b'LinkedIn Member',b'Vice President Patient Care Services',"b""Columbia St. Mary's""",b'',b''
393,b'Bryant Hammig',"b'Vice President, Managed Care & Business Development'",b'AboutHealth',b'Healthcare Executive',b'https://www.linkedin.com/in/bryant-hammig-9826392b/'
394,b'LinkedIn Member',b'Vice President Legal and Corporate Responsibility Services and Associate General Counsel',b'Ministry Health Care',b'',b''
395,b'LinkedIn Member',b'CFO and Vice President - Finance & Operations',"b'Home Care Medical, Inc'",b'',b''
396,b'Terri Wing',"b'Vice President, Medical Group Operations'",b'Wheaton Franciscan Healthcare',"b'Administrative Director, Medical Group Operations and Physician Relations'",b'https://www.linkedin.com/in/terri-wing-386b8035/'
397,b'Patricia Girzadas',b'National Vice President',b'Sg2',b'Independent',b'https://www.linkedin.com/in/patricia-girzadas-80240613/'
398,b'Jim Hendricks',b'Vice President Clinical Reimbursement',b'Lexington Health Network',b'at',b'https://www.linkedin.com/in/jim-hendricks-a715a235/'
399,b'Jon Myhre',b'Vice President',"b'Healthfuse, LLC'",b'Chief Operating Officer at Healthfuse',b'https://www.linkedin.com/in/jonwmyhre/'
400,b'Gretchen Eder Sloan',b'Vice President',"b""Lola's Hope Inc.""",b'at',b'https://www.linkedin.com/in/gretchen-eder-sloan-54188195/'
401,"b'Holly Schlenvogt, MSH, CPM'",b'Executive Vice President',b'HIPAA Collaborative of Wisconsin',b'Accomplished privacy and security consultant. Your trusted compliance partner.',b'https://www.linkedin.com/in/hollyschlenvogt/'
402,b'Ashley Gouge',b'Vice President Client Development',b'Cielo Talent',b'Helping healthcare organizations transform their recruiting functions.',b'https://www.linkedin.com/in/ashleygouge/'
403,b'Carolyn R. Krause',b'Vice President',"b'Lane and Associates, Inc'",b'Nursing and Health Care',b'https://www.linkedin.com/in/carolyn-r-krause-21851b2/'
404,b'Emily Zuelzke',b'Vice President',b'Alverno College Hispanic Student Nurses Acossiation',b'Student at Alverno College',b'https://www.linkedin.com/in/emily-zuelzke-3a17b88b/'
405,b'LinkedIn Member',b'Executive Vice President',b'Greater Milwaukee South',b'',b''
406,b'Amanda Kalupa',b'Vice President of Standards and Education',"b""Women's Panhellenic Association""",b'Healthcare Consulting Intern at Crowe Horwath',b'https://www.linkedin.com/in/amanda-kalupa-0046b05a/'
407,b'Tim Belec',b'Vice President',b'WFHC',"b'Chief Information Officer, Ascension Wisconsin'",b'https://www.linkedin.com/in/tim-belec-41317812/'
408,b'Leann Delaney',b'Regional Vice President of Sales',b'LVM Systems',b'Regional VP of Sales at LVM Systems',b'https://www.linkedin.com/in/leann-delaney-7a117710/'
409,"b'Suzan Yeager, CRCR, CTSM Silver'","b'Vice President, Strategic Events Marketing'","b'Perimeter Perspectives, Inc.'","b'Client Services, Experiential Evolution'",b'https://www.linkedin.com/in/suzan-yeager-crcr-ctsm-silver-7471b1b/'
410,b'LinkedIn Member',b'Executive Vice President Operations',b'MH Imaging',b'',b''
411,b'Jackie Mallow',b'Vice President/Board Member',b'Prader-Willi Syndrome Association of Wisconsin',b'Executive Program Consultant',b'https://www.linkedin.com/in/jackiemallow/'
412,"b'Jeffrey Uhler, M.Div., BCC'",b'Vice President',b'WISCONSIN CHAPLAINCY ASSOCIATION INC',"b""Neuro Chaplain at Aurora St. Luke's Medical Center""",b'https://www.linkedin.com/in/revjeffuhler/'
413,b'Maja Jurisic',"b'Vice-President, Medical Director, Concentra Strategic Accounts'",b'Concentra',"b'MD, CPE'",b'https://www.linkedin.com/in/maja-jurisic-745aa010/'
414,b'LinkedIn Member',b'Vice President',b'Future Healthcare Executives',b'',b''
415,b'Hemant Shah',b'Vice President',b'Milwaukee Radiologists Ltd',b'Radiologist',b'https://www.linkedin.com/in/hemant-shah-930599103/'
416,b'LinkedIn Member',"b'Vice President, Wheaton Franciscan Laboratory, SE WI'",b'Wheaton Franciscan Healthcare',b'',b''
417,b'Edwin Foster',b'Senior Vice President of Later LIfe Enjoyment and Fulfillment',b'Retired',b'RETIRED',b'https://www.linkedin.com/in/edwin-foster-79552819/'
418,b'LinkedIn Member',"b'Vice-President, Human Resources'",b'St. Ann Center for Intergenerational Care',b'',b''
419,b'Lorie Stasik',b'Vice President of Operations',"b'AGHIT Consulting, LLC'",b'VP of Operations',b'https://www.linkedin.com/in/lorie-stasik-a4373114/'
420,b'LinkedIn Member',b'Vice-President',"b'Lifestar Emergency Medical Services, L.L.C.'",b'',b''
421,b'LinkedIn Member',b'Vice President',b'Vines to Cellar',b'',b''
422,b'LinkedIn Member',b'Board Vice President',b'Elmbrook Humane Society',b'',b''
423,b'Nancy Korom',b'Vice President and Chief Nursing Officer',"b""Children's Hospital of WI""","b""Chief Nursing Officer at Children's Hospital of Wisconsin""",b'https://www.linkedin.com/in/nancy-korom-88044113/'
424,b'LinkedIn Member',b'Vice President',"b'A.L.L. Clear, Inc.'",b'',b''
425,b'LinkedIn Member',b'Vice President of Confidentiality Operations',b'Badger SPILL (Supporting Peers in Laidback Listening)',b'',b''
426,"b'Randall L. Thomas, RN, BSN, MBA, CSSGB'",b'Co-Owner / Vice President',"b'RN Consultation and Services, LLC'",b'ICU Manager / All Saints at Wheaton Franciscan Healthcare',b'https://www.linkedin.com/in/randall-l-thomas-rn-bsn-mba-cssgb-74677631/'
427,b'LinkedIn Member',b'Vice President Business Development',b'ACL Laboratories',b'',b''
428,b'Christine Hutchison',b'Vice President Organization & Leadership Development',b'Wheaton Franciscan Healthcare',b'Healthcare Executive',b'https://www.linkedin.com/in/christine-hutchison-24545512/'
429,b'LinkedIn Member',b'Vice President',b'N.E.C.',b'',b''
