,name,position,company,description,linkedin_url
629,Arun Mirchandani,"Sr. Vice President, Products and Technology",Vocera Communications (VCRA),"Head of Products (Technology, R&D, Prog Mgmnt)",https://www.linkedin.com/in/arunmirchandani/
630,"Ronald L. Copeland, MD, FACS",Senior Vice President of National Diversity & Inclusion Strategy and Policy,Kaiser Foundation Health Plan,Diversity & Inclusion Strategist ► Innovative Physician Executive ► Visionary Leader,https://www.linkedin.com/in/ronaldlcopeland/
631,Chris Grant,Chief Operating Officer and Executive Vice President,Kaiser Permanente,Chief Operating Officer and EVP Kaiser Permanente,https://www.linkedin.com/in/chris-grant-2a791264/
632,John Bibby,Regional Vice President,St. Joseph Health,Northern CA VP of HR Providence St Joseph Health,https://www.linkedin.com/in/john-bibby-b660b115/
633,Thomas Leahy,Vice President Sales and Business Development,Aegify,"Managing Director, Synepta Group",https://www.linkedin.com/in/thomas-leahy-a497aa4/
634,Kevin Knopf,Vice President,Rooms that Rock for Chemo,"Chief Medical Officer, Cancer Commons",https://www.linkedin.com/in/drkevinknopf/
635,Elizabeth Stone,Vice President of Operations,Nuna Inc.,Operations at Nuna Inc.,https://www.linkedin.com/in/elizabeth-stone-608a754/
636,Colleen McKeown,Senior Vice President and Area Manager Hospitals/Health Plan,Kaiser Permanente,CEO at Kaiser Permanente,https://www.linkedin.com/in/colleen-mckeown-8b98a834/
637,Erik Bengtsson,Vice President - Coaching Practice / Senior Manager,The Trium Group,Entrepreneurial Builder / Strategic Thought Leader / Executive Coach,https://www.linkedin.com/in/erbengtsson/
638,Helen Wilmot,"Vice President, Facilities Services & Planning",Stanford Health Care,Senior Executive | Board Member | Mentor,https://www.linkedin.com/in/helenwilmot/
639,Madhu Narasimhan,Senior Vice President - Head of Digital PMO,Wells Fargo,SVP - Head of Digital PMO at Wells Fargo,https://www.linkedin.com/in/madhu-narasimhan-81b532/
640,Josh DeFonzo,Vice President,"Auris Surgical Robotics, Inc.","Market, Customer, and Product Development Leader",https://www.linkedin.com/in/joshdefonzo/
641,Ali Farzad,Internal Vice President,Seed of Health,"Student at University of California, Berkeley",https://www.linkedin.com/in/ali-farzad-861967107/
642,Jenny Visperas,Account Vice President,Visiant Health,Sr. Relationship Manager at ikaSystems,https://www.linkedin.com/in/jenny-visperas-97a8608/
643,George Gardner-Serra,"Regional Vice President, Healthcare Strategy & Innovation (West Region Lead)",North Highland,Senior Advisor & Investor - Healthcare Strategy & Innovation,https://www.linkedin.com/in/georgegardner/
644,Steve Silverstein,"Vice President, Chief Clinical Architect",McKesson Corp.,VP at McKesson Corp.,https://www.linkedin.com/in/steve-silverstein-5778544/
645,Anthony Redmond,Vice President Human Resources,Alameda Health System,Chief Human Resources Officer at Alameda Health System,https://www.linkedin.com/in/anthony-redmond-80510b3/
646,Russ Cucina,"Vice President, Health Informatics and Chief Health Information Officer",UCSF Health,"VP Health Informatics and Chief Health Information Officer, Professor of Hospital Medicine",https://www.linkedin.com/in/rjcucina/
647,Jason Erdell,"Executive Vice President, Technology-Enabled Services",Change Healthcare,EVP Technology-Enabled Services at Change Healthcare,https://www.linkedin.com/in/jason-erdell-25373b13/
648,Jason Higgins,Vice President - Strategy & Business Development/M&A,McKesson,Corporate & Business Development,https://www.linkedin.com/in/jason-higgins-8177a2/
649,Rhonda R Foster,Interim Senior Vice President and Chief Nursing and Patient Care Services Officer,City of Hope,Consultant,https://www.linkedin.com/in/rhonda-r-foster-a6305b14/
650,Patrick Nelli,"Senior Vice President, CAFE Product Line",Health Catalyst,"SVP, Health Catalyst",https://www.linkedin.com/in/jpatricknelli/
651,Matt Neal,Vice President - Vantage Oncology,McKesson,"Strategy and Business Development, McKesson",https://www.linkedin.com/in/matthewrneal/
652,"Becca Lococo, PhD","Vice President, Strategy",The Advisory Board Company,"Innovative healthcare professional, passionate about transforming healthcare",https://www.linkedin.com/in/becca-lococo-phd-a713185/
653,Ramya Singh,Vice President - North & South America,INSIGHTEC,Commercial Leader | High Growth Start Up Accelerator | General Manager | Business Development | Healthcare,https://www.linkedin.com/in/ramyasingh/
654,Mark Heit,"Senior Vice President, National Strategy & Development",Beacon Health Options,SVP of National Strategy & Development at Beacon Health Options,https://www.linkedin.com/in/mark-heit-8333516/
655,Wendy Foad,Interim Vice President Patient Care Services and Chief Nursing Officer,Stanford Health Care,Associate Chief Nursing Officer at Stanford Health Care,https://www.linkedin.com/in/wendy-foad-b363326/
656,Efton Hall,"Vice President, Healthcare Division",Management Recruiters of Berkeley,"Executive Search, Healthcare",https://www.linkedin.com/in/eftonhall/
657,LinkedIn Member,"Senior Vice President, Corporate Real Estate",Dignity Health,,
658,Mitchell Baum,"Regional Vice President of Payer Sales, Commercial West",Edifecs,"Regional VP of Payer Sales, Commercial West",https://www.linkedin.com/in/mitchbaum/
659,Tom Bobich,"Vice President, Marketing",Advanced ICU Care,Leadership for Growing Service Businesses,https://www.linkedin.com/in/tombobich/
660,Trevor Thompson,Vice President of Business Development,Royal Ambulance,"Healthcare Executive | VP, Business Development at Royal Ambulance",https://www.linkedin.com/in/trevorsthompson/
661,"Harly Neumann, PhD, SPHR","Vice President of Human Resources, Sutter Health Bay Area Foundation",Sutter Health,Healthcare HR Executive,https://www.linkedin.com/in/harlyneumann/
662,Phil Chuang,"Vice President, Strategy and Business Development, Sutter Care",Home at Sutter Health,"VP, Strategy and Business Development, Sutter Care at Home at Sutter Health",https://www.linkedin.com/in/philchuang/
663,Todd Strumwasser,Senior Vice President Operations,Dignity Health,Dignity Health,https://www.linkedin.com/in/todd-strumwasser-928885b/
664,Chris Boyd,Senior Vice President/Area Manager,Kaiser Permanente Santa Clara Medical Center,Healthcare Leader,https://www.linkedin.com/in/chris-boyd-1786623/
665,Mark Williams,Vice President IT/Chief Security Officer,Pacific Pulmonary Services,,https://www.linkedin.com/in/markpatrickwilliams/
666,LinkedIn Member,Vice President and Medical Director,California Advanced Imaging Medical Associates,,
667,Mike Patel,Chief Information Officer & Vice President,Verity Medical Foundation,CIO & VP at Verity Medical Foundation,https://www.linkedin.com/in/mike-patel-913385b/
668,Wade Bolton,"Divisional Vice President, Hematology R&D",Abbott Laboratories,"Divisional VP R&D, Abbott Hematology",https://www.linkedin.com/in/wade-bolton-85213a10/
669,Alyssa Kwan,Vice President,California Health Professional Student Alliance (CaHPSA),"Student at University of California, Davis",https://www.linkedin.com/in/alyssa-kwan/
670,Michael Blaszyk,Senior Executive Vice President & Chief Financial Officer,Dignity Health,Director at Sound Physicians,https://www.linkedin.com/in/michael-blaszyk-83096435/
671,Erin Ackenheil,Vice President Sales,"Anthem, Inc.",Healthcare Executive,https://www.linkedin.com/in/erin-ackenheil-5a582713/
672,Shaun Bodington,"Vice President, New Product Development",Experian Health,Transformation in Health,https://www.linkedin.com/in/bodington/
673,Brad Wolfsen,Senior Vice President,bswift,Healthcare Executive & Innovator,https://www.linkedin.com/in/brad-wolfsen-5a0a96/
674,Jennifer Payne,Vice President of Operations,Premise Health,Executive Director at Groups: recover together.,https://www.linkedin.com/in/jenniferlynnpayne/
675,Shay Strachan,Vice President Strategic Partnerships & Network Development,UCSF Medical Center,Strategic Partnerships at UCSF Health,https://www.linkedin.com/in/shaystrachan/
676,LinkedIn Member,"VIce President, Clinical Services (interim)",UCSF Medical Center,,
677,Deepak Khuntia,"Senior Vice President, Chief Medical Officer",Varian Medical Systems,Radiation Oncologist at PCS Medical Group,https://www.linkedin.com/in/deepak-khuntia-01348410/
678,Elizabeth Conrady,"Vice President, Marketing - Health 2.0 San Francisco",Health 2.0,Marketing & Business Development | Healthcare,https://www.linkedin.com/in/elizabethconrady/
679,Anthony Barrueta,"Senior Vice President, Government Relations",Kaiser Foundation Health Plan,Government Relations Executive at Kaiser Foundation Health Plan,https://www.linkedin.com/in/anthony-barrueta-1951a67/
680,kelly johnson,"Vice President Patient Care Services, Chief Nursing Officer",Stanford Children's Health | Lucile Packard Children's Hospital Stanford,Clinical Associate Professor (Affiliated) at Stanford University School of Medicine,https://www.linkedin.com/in/kelly-johnson-08301810b/
681,Murali Naidu,"Vice President, Chief Clinical Officer",Sentara Healthcare,Chief Clinical Officer at Sentara Healthcare,https://www.linkedin.com/in/muralinaidu/
682,Sean Van Slyck,Vice President - Organ Operations,Donor Network West,Chief Operating Officer at Donor Network West,https://www.linkedin.com/in/sean-van-slyck-a473925/
683,Justin Ferber,Vice President & General Counsel,Omada Health,General Counsel at Omada Health,https://www.linkedin.com/in/justinferber/
684,Victor Valenzuela,Vice President Ministry Formation,Dignity Health,VP Ministry Formation,https://www.linkedin.com/in/victor-valenzuela-2aa67130/
685,Jennifer Kurkjian,"Vice President, Managed Care",Dignity Health,"""We either get success or lessons. If we learn our lessons successfully, we get both"". C. Jung",https://www.linkedin.com/in/jennifer-kurkjian-5235bba/
686,LinkedIn Member,"Vice President, Global Marketing & Customer Service",NDS Surgical Imaging,,
687,Murray Ross,Vice President,"Kaiser Foundation Health Plan, Inc.","Health Care Finance and Policy Expert, Kaiser Permanente",https://www.linkedin.com/in/murray-ross-7793654/
688,Scott Ptacnik,"Vice President, Accountable Care Operations",University Healthcare Alliance (UHA),Healthcare Strategy & Operations Executive,https://www.linkedin.com/in/scottptacnik/
689,Richard Katzman,"Executive Vice President, Operations",LA BioMed – Los Angeles Biomedical Research Institute,Chief Strategy Officer at El Camino Hospital,https://www.linkedin.com/in/richard-katzman-7335a8b9/
690,LinkedIn Member,First Vice President,American Dental Association,,
691,Josh Raimondi,"Senior Vice President - Western Region, Medline Homecare division",Medline Industries,"Senior VP - Western Region, MEDLINE HomeCare division",https://www.linkedin.com/in/josh-raimondi-8a7a58/
692,Carolina Zubiri,Vice-president,Kids With Dream,Attending Stanford University,https://www.linkedin.com/in/carolina-zubiri-77771662/
693,Samiha Uddin,Vice President,Muslim Student Association,Student at UC Berkeley,https://www.linkedin.com/in/samiha-uddin-05484928/
694,Dave Jimil Morales,Founding Vice President,"Morning Sign Out, UCSC Chapter","Undergraduate Research Assistant, Hinck Lab at UCSC Biomedical Sciences Building",https://www.linkedin.com/in/davejpmorales/
695,Raadhika Shah,Chapter Vice President,American Medical Women's Association (AMWA),Majoring in Biological Sciences at Cal Poly San Luis Obispo,https://www.linkedin.com/in/raadhikashah/
696,Delia Peterson,"Vice President, Physician Services",Brown and Toland Medical Group,COO,https://www.linkedin.com/in/delia-peterson-0b9a8711/
697,"Elizabeth R. Carty, MSW",Executive Vice President,WelbeHealth,Expert in the Program of All-inclusive Care for the Elderly (PACE),https://www.linkedin.com/in/cartyconsulting/
698,Hala Helm,Executive Vice President,"Capstone Insurance, LLC",Chief Risk Officer at Palo Alto Foundation Medical Group,https://www.linkedin.com/in/hala-helm-5b40b59/
699,Karen Hwang,"Vice President, Practice Optimization",Evolent Health,Experienced Healthcare Strategy Consultant,https://www.linkedin.com/in/karen-hwang-a3786b5/
700,Sherry Jennings,Vice President of CA Underwriting,Kaiser Permanente,"VP of Underwriting CA, Kaiser Permanente",https://www.linkedin.com/in/sherry-jennings-421965bb/
701,Yasmeen Ahmed,Organizing Director in the Office of External Affairs Vice President,Associated Students of the University of California,Organizing Director for Associated Students of the University of California (ASUC),https://www.linkedin.com/in/yasmeenahmed/
702,Sherie Ambrose,"Vice President,Patient Care Services/CNE",Dignity Health,VP Patient Care Services/CNE at Dignity Health,https://www.linkedin.com/in/sherie-ambrose-6a516653/
703,"Mike Williams, MPA/HSA",Executive Vice President,The,Emergency Medical Care Vision Creator,https://www.linkedin.com/in/theabarisgroup/
704,Traci (Hoiting) Duncan,"Vice President, Chief Nursing Officer",NorthBay Healthcare,"VP, Chief Nursing Officer",https://www.linkedin.com/in/traci-hoiting-duncan-1a6521b/
705,Rena Flovin,Vice President,Alliance Occupational Medicine,"Work injuries, respiratory testing, DMV physicals, drug screenings, EHS and employer services.",https://www.linkedin.com/in/rena-flovin-3a10a08/
706,Jib Martens,Vice President Business Development,"PSYCHeANALYTICS, Inc.",Growth Driven Entrepreneur and Business Developer,https://www.linkedin.com/in/jibmartens/
707,Rahul Joglekar,"Vice President | Head of Strategy, Provider Division","Truven Health Analytics, an IBM Company",Strategy Head | Provider business of IBM Watson Health,https://www.linkedin.com/in/rahul-joglekar-9991567/
708,George Stemerman,"Vice President, Taft Hartley Services",Manning & Napier,Director at Burd Health,https://www.linkedin.com/in/george-stemerman-4338439/
709,"Cathy O'Brien, RN, CHC",Vice President Quality and Patient Safety (Interim),Alameda Health System,"Director, Accreditation and Patient Safety",https://www.linkedin.com/in/cathyobrien/
710,"Erin M. Faverty, MA COML","Vice President, Customer Success",LeaveLogic,"VP, Customer Success at LeaveLogic",https://www.linkedin.com/in/erinmfaverty/
711,Damien Mar Chong,"Chief Financial Officer & Vice President, Operations",Lumetra Healthcare Solutions,Chief Financial Officer at Lumetra Healthcare Solutions,https://www.linkedin.com/in/damienmarchong/
712,Duncan Ross,"Vice President and General Manager, Specialty Benefits",Blue Shield of California,Experienced Health Care and Management Executive,https://www.linkedin.com/in/duncan-ross-875511/
713,Ruth Kenzelmann,Vice President of Employee Assistance Programs and WorkLife Services,Optum,VP of Employee Assistance Programs and WorkLife Services at UnitedHealth Group,https://www.linkedin.com/in/ruthkenzelmann/
714,Yen X Tran,Executive Vice President,Empire Auto Body Parts,Blood Transfusion Lab Tech at Stanford Hospital,https://www.linkedin.com/in/yen-x-tran-70b76323/
715,LinkedIn Member,Vice-president Finance and Treasurer,Sutter Health,,
716,Lynn Messick,"Vice President, Strategic Accounts",Change Healthcare,"Surpassing Patient Care, Cost Reduction & Revenue Goals Effectively & Efficiently, Change Healthcare",https://www.linkedin.com/in/lynnmessick/
717,Elaine Cheng,"Outreach of Assistant Director, Office of Executive Vice President",Associated Students of the University of California,Pharmacy Technician Trainee at CVS Pharmacy,https://www.linkedin.com/in/elaine-cheng-950283112/
718,Melissa Johnson,Assistant Medical Group Administrator (Vice President of Strategy and Operations),Kaiser Permanente,"Senior Healthcare Leader, Kaiser Permanente",https://www.linkedin.com/in/melissa-johnson/
719,Dave Birdsall,Vice President,CEP America,Chief Operating Officer at CEP America,https://www.linkedin.com/in/dave-birdsall-9831384/
720,Julie Stoss,Vice President Government Relations,Kaiser Foundation Health Plan,--,https://www.linkedin.com/in/julie-stoss-17a99490/
721,Martha Lauderdale,"Vice President- Anesthesia, Diagnostic Imaging, Lab and Pharmacy Service Line",Sutter Health - Palo Alto Medical Foundation,Transforming healthcare operations through engaged teams; aligned goals; and innovative problem solving.,https://www.linkedin.com/in/martha-lauderdale-a7260b10/
722,Pamela Brotherton-Sedano,"Vice President, Patient Safety/ Corporate Compliance Officer / Operations",O'CONNOR HOSPITAL / VERITY HEALTHCARE / DAUGHTERS OF CHARITY HEALTH SYSTEM,Corporate Compliance | Investigations | Risk Management | Social Responsibility | Operations,https://www.linkedin.com/in/pamelabrothertonsedano/
723,Ngan Vo,Vice President of Leadership and Finance,Culturally Focused Clubs Council,Cashier at Arguello Super Market,https://www.linkedin.com/in/ngankvo/
724,LinkedIn Member,Vice-President / Co-Founder,"H2O: Helping to Overcome, Inc.",,
725,Sue Currie,Senior Vice President,Health Interactions,,https://www.linkedin.com/in/sue-currie-44526ba/
726,Ellen Zoschak,"Vice President, Performance Improvement Consulting Practice Leader",Truven Health Analytics (The Healthcare Business of Thomson Reuters is now Truven Health Analytics.),Innovative Healthcare Consulting Executive,https://www.linkedin.com/in/ellenzoschak/
727,"William To, OD ABOC",Executive Vice President,SOLutioN,Doctor of Optometry,https://www.linkedin.com/in/willto/
728,"Stephenie Fenton-Wilhelm, JD, ARM-E, CPHRM",Vice President of Consulting and Marketing Operations,The Risk Authority Stanford,Director of Risk Management Consulting at Stanford Health Care,https://www.linkedin.com/in/stepheniefenton/
729,Anna Gill,Vice President,"Aetna/Coventry Health Care, Inc.","Head of Human Resources, Service Operations at Aetna, Inc.",https://www.linkedin.com/in/annagill/
730,Robert Goldberg,Chief Medical Officer and Senior Vice-President,Healthesystems,Chief Medical Officer/ SVP at Healthesystems LLC,https://www.linkedin.com/in/robert-goldberg-0507b523/
731,LinkedIn Member,Senior Vice President | Global Director of Healthcare,HOK at HOK,,
732,Stephanie Chen,Vice President,AACN Tri-Valley Chapter,Clinical Manager-Interventional Services at El Camino Hospital,https://www.linkedin.com/in/stephanie-chen-51a7436a/
733,Pascale-Sonia Roy,Vice President Assistant General Counsel/Chief Labor Employment Officer,Verity Health System,Associate General Counsel/Chief Labor Employment Officer,https://www.linkedin.com/in/pascale-sonia-roy-28993954/
734,Cindy Rider,Area Vice President of Operations,Kindred at Home,Chief Hospice Executive,https://www.linkedin.com/in/cindy-rider-8a8b0711/
735,Dana Orquiza,Assistant Vice President of Risk Management,The Risk Authority at Stanford,"Director, Risk Management at Stanford University Medical Center",https://www.linkedin.com/in/dana-orquiza-a368556/
736,Denise Hair,Vice President Nursing Services/Chief Nursing Officer,Dameron Hospital Association,VP Nursing Services/Chief Nursing Officer at Dameron Hospital Association,https://www.linkedin.com/in/denise-hair-0a33b330/
737,Mitch Cohen,Senior Vice President & General Counsel,"CEP America, LLC / MedAmerica, Inc.",Healthcare Legal Executive │General Counsel,https://www.linkedin.com/in/mitch-cohen-39228a4/
738,Scott Fuller,"Vice President, Employee & Labor Relations",Dignity Health,"VP, Employee & Labor Relations at Dignity Health",https://www.linkedin.com/in/scott-fuller-7182754/
739,Norma Avila,Executive Admin Coordinator - Vice President of Primary Care/Directors of Operations,Stanford Health Care,Exectutive Administrative Coordinator at Stanford Health Care,https://www.linkedin.com/in/norma-avila-41994310/
740,LinkedIn Member,Executive Assistant to Chief Medical Information Officer and Vice President of Clinical Systems,UCSF,,
741,Diane Testa,Vice President of Sales and Marketing,Crossroads Home Health & Hospice,VP of Sales & Marketing for Crossroads Home Health and Hospice,https://www.linkedin.com/in/diane-testa-93914911/
742,Steven Schlossberg,Vice President and Chief Medical Officer,Impact Advisors,VP and CMIO John Muir Health,https://www.linkedin.com/in/steven-schlossberg-0689878a/
743,LinkedIn Member,Planning and Transportation Commissioner (Vice Chair),City of Los Altos,,
744,Maribel Gutierrez,"Director of Student Affairs, Board Vice President (Part-Time)","METAS, Inc. (Non-Profit)",Manager of Business Operations,https://www.linkedin.com/in/maribel-gutierrez-510375a5/
745,Steven Scott,VIce President Account Management,Trinity Management Services,Revenue Cycle Manager,https://www.linkedin.com/in/steven-scott-18b35912/
746,LinkedIn Member,"Vice President, Assistant Treasurer",Dignity Health (fka Catholic Healthcare West),,
747,Sean Sullivan,Vice President,veriHealth Inc.,Healthcare Professional,https://www.linkedin.com/in/sean-sullivan-316a381/
748,LinkedIn Member,"Vice President, Compliance & Risk Management",Satellite Healthcare / WellBound,,
749,Rex Cherng,Vice President,Arbor Solution - Medical,Building a global Telehealth Eco system,https://www.linkedin.com/in/rex-cherng-b205b526/
750,LinkedIn Member,Vice President - Finance,Adventist Health/Saint Helena Region,,
751,Julie Richards,Senior Vice President Finance & Administration,Freed Associates,,https://www.linkedin.com/in/julie-richards-4743931/
752,LinkedIn Member,"Vice President, Knowledge Management & Strategy",MedAmerica / CEP America,,
753,Mary Obot,Regional Vice President,Stericycle Communication Solutions,Healthcare Communications Consultant at Stericycle Communication Solutions,https://www.linkedin.com/in/mary-obot-692aa229/
754,Molly McGlynn Knoderer,Founder/ Vice President of Business Development,Legacy Concierge Services,Founder at Legacy Concierge Services,https://www.linkedin.com/in/molly-mcglynn-knoderer-27608210/
755,Karen Saylors,"Vice President, Field Research",Metabiota,"VP, Field Research",https://www.linkedin.com/in/karen-saylors-b8aa683/
756,Deb Friedman,Senior Vice President Operations Finance,Rockport Healthcare Services,Financial Operations,https://www.linkedin.com/in/deb-friedman-16a11548/
757,Lior Molvin,Vice President for Technologists,ISCT – International Society for Computed Tomography,Radiologic Technologist Coordinator for CT Protocols and Educational Development at Stanford Healthcare.,https://www.linkedin.com/in/lior-molvin-92703140/
758,"Erin Hallett PT, DPT, NCS",Vice President and Cofounder,No Limits Collaborative,Physical Therapist,https://www.linkedin.com/in/erin-hallett-pt-dpt-ncs-27547b23/
759,LinkedIn Member,Vice President of Information Technology & Facilities,Planned Parenthood,,
760,Sheila Pederson,Vice President Revenue Cycle Trident West,Diagnistic Laboratories and Radiology,Experienced Health Care Revenue Cycle Management,https://www.linkedin.com/in/sheila-pederson-3747938/
761,Olivia Uhley,Service Vice President,"Kappa Gamma Delta, UC Berkeley",Research Interviewer at RTI International,https://www.linkedin.com/in/olivia-uhley-68894585/
762,Bruce Davis,Vice President Operations,VITAS Healthcare,General Manager at Vitas,https://www.linkedin.com/in/bruce-davis-54220914/
763,"Ben Wilson, MBA, MPH","Vice President Business Development, Healthcare (Consultant)",CloudPost Networks,"Digital Health Business Development, Strategy and Alliances",https://www.linkedin.com/in/bencwilson/
764,Yasmin Hadian,Vice President,Sigma Sigma Phi National Honors Fraternity - Tau Chapter,Medical Student at Touro University California,https://www.linkedin.com/in/yasmin-hadian-46431328/
765,Tom Stucke,Vice President Public Sector,Netsmart Technologies,VP Public Sector at Netsmart Technologies,https://www.linkedin.com/in/tom-stucke-5561274/
766,LinkedIn Member,"General Counsel & VIce President Legal, Compliance and Human Resources",Brown & Toland Physicians,,
767,Kathleen Murren,Vice President,Freed Associates,Healthcare Information Technology Consultant,https://www.linkedin.com/in/kmurren/
768,Lisa Chalmers,Vice President Finance,American Medical Response,Director of Finance at American Medical Response,https://www.linkedin.com/in/lisa-chalmers-024a731a/
769,John Heverly,Vice President Of Business Development,Pertexa Medical Technologies,SVP Business Development,https://www.linkedin.com/in/john-heverly-7542a45/
770,LinkedIn Member,"Vice President, Laboratory Operations",Ascend Clinical (Formally: Satellite Laboratory Services),,
771,Alexander Baskoro,Vice President of Programming,"Phi Delta Epsilon, CA Iota",Aspiring Physician,https://www.linkedin.com/in/alexander-baskoro-46a547115/
772,Jennifer Bayard,Senior Vice President Clinical Operations,Carlton Senior Living,--,https://www.linkedin.com/in/jennifer-bayard-b6071010b/
773,kun Wang,Vice President,Department of Scholar Affairs ACSSS Board (2014-2015),visiting scholar at Stanford Hospital & Clinics,https://www.linkedin.com/in/kun-wang-8254b2a0/
774,Ruidan Ma,"Chapter President,Vice President, Immediate Past President",American Student Dental Association,DDS Candidate at University of the Pacific,https://www.linkedin.com/in/ruidan-ma-8b411a73/
775,Chris McMahon,Vice President,Bay Area Surgical Management,--,https://www.linkedin.com/in/chris-mcmahon-b8223343/
776,LinkedIn Member,Vice-President - Co-owner,California Star,,
777,LinkedIn Member,Vice President,CALIFORNIA ACADEMY OF GENERAL DENTISTRY,,
778,"Melissa ""Missy"" Ring","Vice President of Quality, Education, & Compliance",Hospice of the East Bay,"VP of Quality, Education, and Compliance",https://www.linkedin.com/in/melissa-missy-ring-a8175931/
779,"Melissa Ko, DC",Vice President of Sales and Marketing,NetErgonomics,Doctor of Chiropractic at Sycamore Valley Chiropractic,https://www.linkedin.com/in/melissa-ko-dc-240a041a/
780,"Liz Camino-Byers DDS, ret.",Board of Directors Santa Rosa Community Health Centers (Past Vice President),South West Community Health Center,Board of Directors Santa Rosa Community Health Centers,https://www.linkedin.com/in/liz-camino-byers-dds-ret-637a3111/
781,Yashodhan Mirashi,Club Vice President,AID India,"Student at University of California, Berkeley",https://www.linkedin.com/in/yashodhan-mirashi-534387128/
